{
  "kind": "investigation",
  "limitations": [
    "Synthetic point-estimator scenario only. Failure labels are study criteria, not radio tolerance, safety thresholds, or flight performance."
  ],
  "schema": "zephyr-evidence-report-1",
  "source": {
    "name": "investigation_example.json",
    "schema": "zephyr-s6-sweep-1",
    "sha256": "c3430af134b0a06c41672dcaf40f601442db201f8fc597f3922263a1e85892ed"
  },
  "status": "synthetic",
  "summary": {
    "config": {
      "duration_s": 8.0,
      "failure_max_m": 0.5,
      "failure_p95_m": 0.25,
      "observation_period_s": 0.1,
      "seed": 17,
      "target_acceleration_mps2": 0.0,
      "target_speed_mps": 0.7,
      "truth_dt_s": 0.02
    },
    "criterion_note": "The failure label is a scenario-specific research criterion, not a safety threshold.",
    "independent_check": "For a held-last-position estimate, v x L = 0.7 m/s x 0.10 s = 0.07 m before noise or dropout.",
    "provenance": {
      "evidence_boundary": "scenario investigation report; not flight performance or a safety threshold",
      "source_status": "synthetic investigation fixture; not flight performance",
      "status": "synthetic"
    },
    "rows": [
      {
        "criterion": "p95>0.25 m OR max>0.5 m",
        "delay_s": 0.0,
        "held_last_max_error_m": 0.056000000000000494,
        "held_last_p95_error_m": 0.05600000000000005,
        "label": "within-scenario-envelope",
        "loss_probability": 0.0,
        "max_error_m": 0.055999999999999994,
        "mean_age_s": 0.0,
        "noise_std_m": 0.0,
        "p95_error_m": 2.080321211406222e-07,
        "sample_count": 401,
        "target_acceleration_mps2": 0.0
      },
      {
        "criterion": "p95>0.25 m OR max>0.5 m",
        "delay_s": 0.0,
        "held_last_max_error_m": 0.37360000000000326,
        "held_last_p95_error_m": 0.2936000000000014,
        "label": "within-scenario-envelope",
        "loss_probability": 0.0,
        "max_error_m": 0.05759999999999999,
        "mean_age_s": 0.0,
        "noise_std_m": 0.0,
        "p95_error_m": 0.002754701016563388,
        "sample_count": 401,
        "target_acceleration_mps2": 0.5
      },
      {
        "criterion": "p95>0.25 m OR max>0.5 m",
        "delay_s": 0.0,
        "held_last_max_error_m": 0.1172534130298783,
        "held_last_p95_error_m": 0.0804612528885641,
        "label": "within-scenario-envelope",
        "loss_probability": 0.0,
        "max_error_m": 0.07233517560668644,
        "mean_age_s": 0.0,
        "noise_std_m": 0.02,
        "p95_error_m": 0.04219227325292627,
        "sample_count": 401,
        "target_acceleration_mps2": 0.0
      },
      {
        "criterion": "p95>0.25 m OR max>0.5 m",
        "delay_s": 0.0,
        "held_last_max_error_m": 0.4076765089479887,
        "held_last_p95_error_m": 0.3067614368331966,
        "label": "within-scenario-envelope",
        "loss_probability": 0.0,
        "max_error_m": 0.07932408931257251,
        "mean_age_s": 0.0,
        "noise_std_m": 0.02,
        "p95_error_m": 0.059138395899060614,
        "sample_count": 401,
        "target_acceleration_mps2": 0.5
      },
      {
        "criterion": "p95>0.25 m OR max>0.5 m",
        "delay_s": 0.0,
        "held_last_max_error_m": 0.21489443702431965,
        "held_last_p95_error_m": 0.14846439118396088,
        "label": "within-scenario-envelope",
        "loss_probability": 0.0,
        "max_error_m": 0.1555890940027102,
        "mean_age_s": 0.0,
        "noise_std_m": 0.05,
        "p95_error_m": 0.10141019838559621,
        "sample_count": 401,
        "target_acceleration_mps2": 0.0
      },
      {
        "criterion": "p95>0.25 m OR max>0.5 m",
        "delay_s": 0.0,
        "held_last_max_error_m": 0.4239807846708526,
        "held_last_p95_error_m": 0.3121635187745784,
        "label": "within-scenario-envelope",
        "loss_probability": 0.0,
        "max_error_m": 0.17986525034213924,
        "mean_age_s": 0.0,
        "noise_std_m": 0.05,
        "p95_error_m": 0.10757424299686992,
        "sample_count": 401,
        "target_acceleration_mps2": 0.5
      },
      {
        "criterion": "p95>0.25 m OR max>0.5 m",
        "delay_s": 0.0,
        "held_last_max_error_m": 0.1260000000000001,
        "held_last_p95_error_m": 0.09799999999999986,
        "label": "within-scenario-envelope",
        "loss_probability": 0.1,
        "max_error_m": 0.055999999999999994,
        "mean_age_s": 0.0,
        "noise_std_m": 0.0,
        "p95_error_m": 1.0130226288374011e-06,
        "sample_count": 401,
        "target_acceleration_mps2": 0.0
      },
      {
        "criterion": "p95>0.25 m OR max>0.5 m",
        "delay_s": 0.0,
        "held_last_max_error_m": 0.8091000000000008,
        "held_last_p95_error_m": 0.32559999999999967,
        "label": "within-scenario-envelope",
        "loss_probability": 0.1,
        "max_error_m": 0.05759999999999999,
        "mean_age_s": 0.0,
        "noise_std_m": 0.0,
        "p95_error_m": 0.0053320514614791925,
        "sample_count": 401,
        "target_acceleration_mps2": 0.5
      },
      {
        "criterion": "p95>0.25 m OR max>0.5 m",
        "delay_s": 0.0,
        "held_last_max_error_m": 0.1424205456075777,
        "held_last_p95_error_m": 0.0947606899878656,
        "label": "within-scenario-envelope",
        "loss_probability": 0.1,
        "max_error_m": 0.1344820358807106,
        "mean_age_s": 0.0,
        "noise_std_m": 0.02,
        "p95_error_m": 0.05271729036995039,
        "sample_count": 401,
        "target_acceleration_mps2": 0.0
      },
      {
        "criterion": "p95>0.25 m OR max>0.5 m",
        "delay_s": 0.0,
        "held_last_max_error_m": 0.6717793358013205,
        "held_last_p95_error_m": 0.3395200544897453,
        "label": "within-scenario-envelope",
        "loss_probability": 0.1,
        "max_error_m": 0.12418309179351562,
        "mean_age_s": 0.0,
        "noise_std_m": 0.02,
        "p95_error_m": 0.055821867231917,
        "sample_count": 401,
        "target_acceleration_mps2": 0.5
      },
      {
        "criterion": "p95>0.25 m OR max>0.5 m",
        "delay_s": 0.0,
        "held_last_max_error_m": 0.20415454749102746,
        "held_last_p95_error_m": 0.1581748620836769,
        "label": "within-scenario-envelope",
        "loss_probability": 0.1,
        "max_error_m": 0.12186206940513551,
        "mean_age_s": 0.0,
        "noise_std_m": 0.05,
        "p95_error_m": 0.09291673932257148,
        "sample_count": 401,
        "target_acceleration_mps2": 0.0
      },
      {
        "criterion": "p95>0.25 m OR max>0.5 m",
        "delay_s": 0.0,
        "held_last_max_error_m": 0.8163514173759164,
        "held_last_p95_error_m": 0.37507711517348336,
        "label": "within-scenario-envelope",
        "loss_probability": 0.1,
        "max_error_m": 0.14550970221353127,
        "mean_age_s": 0.0,
        "noise_std_m": 0.05,
        "p95_error_m": 0.10821720183069018,
        "sample_count": 401,
        "target_acceleration_mps2": 0.5
      },
      {
        "criterion": "p95>0.25 m OR max>0.5 m",
        "delay_s": 0.0,
        "held_last_max_error_m": 0.2659999999999991,
        "held_last_p95_error_m": 0.15399999999999991,
        "label": "within-scenario-envelope",
        "loss_probability": 0.3,
        "max_error_m": 0.12474937707305617,
        "mean_age_s": 0.0,
        "noise_std_m": 0.0,
        "p95_error_m": 8.053062281965229e-06,
        "sample_count": 401,
        "target_acceleration_mps2": 0.0
      },
      {
        "criterion": "p95>0.25 m OR max>0.5 m",
        "delay_s": 0.0,
        "held_last_max_error_m": 2.0976,
        "held_last_p95_error_m": 0.9470999999999989,
        "label": "within-scenario-envelope",
        "loss_probability": 0.3,
        "max_error_m": 0.0645632860779699,
        "mean_age_s": 0.0,
        "noise_std_m": 0.0,
        "p95_error_m": 0.028399999999999998,
        "sample_count": 401,
        "target_acceleration_mps2": 0.5
      },
      {
        "criterion": "p95>0.25 m OR max>0.5 m",
        "delay_s": 0.0,
        "held_last_max_error_m": 0.31887847629896515,
        "held_last_p95_error_m": 0.19404132490195816,
        "label": "within-scenario-envelope",
        "loss_probability": 0.3,
        "max_error_m": 0.0681019036311004,
        "mean_age_s": 0.0,
        "noise_std_m": 0.02,
        "p95_error_m": 0.05202648488164409,
        "sample_count": 401,
        "target_acceleration_mps2": 0.0
      },
      {
        "criterion": "p95>0.25 m OR max>0.5 m",
        "delay_s": 0.0,
        "held_last_max_error_m": 1.3038088289379963,
        "held_last_p95_error_m": 0.7290197997596178,
        "label": "within-scenario-envelope",
        "loss_probability": 0.3,
        "max_error_m": 0.11291392195799681,
        "mean_age_s": 0.0,
        "noise_std_m": 0.02,
        "p95_error_m": 0.07729406677131227,
        "sample_count": 401,
        "target_acceleration_mps2": 0.5
      },
      {
        "criterion": "p95>0.25 m OR max>0.5 m",
        "delay_s": 0.0,
        "held_last_max_error_m": 0.31368421840647076,
        "held_last_p95_error_m": 0.2086587561738761,
        "label": "within-scenario-envelope",
        "loss_probability": 0.3,
        "max_error_m": 0.1668723228122368,
        "mean_age_s": 0.0,
        "noise_std_m": 0.05,
        "p95_error_m": 0.09781009289105225,
        "sample_count": 401,
        "target_acceleration_mps2": 0.0
      },
      {
        "criterion": "p95>0.25 m OR max>0.5 m",
        "delay_s": 0.0,
        "held_last_max_error_m": 1.1487200377404354,
        "held_last_p95_error_m": 0.6174403771720517,
        "label": "within-scenario-envelope",
        "loss_probability": 0.3,
        "max_error_m": 0.16442831745917577,
        "mean_age_s": 0.0,
        "noise_std_m": 0.05,
        "p95_error_m": 0.1343283170289521,
        "sample_count": 401,
        "target_acceleration_mps2": 0.5
      },
      {